CME 591,"Biomedical Engineering I","Introduction to the fundamental concepts in biomedical engineering with a special focus on chemical engineering applications. Biomedical topics include overviews of areas such as biomaterials, tissue engineering, biosensors and biomedical engineering technology. Second term, each year.",BIO 151,CME 324,BIE 501
CME 523,"Transport Phenomena in Biological Systems","An integrated interdisciplinary systems-based examination of biological transport phenomena (momentum, heat and mass) and hemodynamics through mathematical modeling and biological processes as applied to physiological systems, with a focus on the cardiovascular, respiratory, and renal systems.",BIE 503,BIE 505,BIO 151,BIO 152,MTH 218
BIE 590,"Selected Readings in Bioengineering","Directed readings in selected areas of bioengineering to be arranged and approved by the advisor and the program director."
BIE 595,"Special Problems in Bioengineering","Special assignments in bioengineering to be arranged and approved by the advisor and the program director."
BIE 597,"Research Methods","This course will provide students the ability to apply research methods and problem solving skills to identify and define a research problem, develop hypotheses and research plans to test those hypotheses. Students will write and present an original research proposal."
BIE 598,"Capstone Project","This is a capstone project to be used by non-thesis students. Students must submit a proposal and a final report."
BIE 599,"Thesis","This is a two course sequence to cover the research and thesis preparation of the graduate student."
BIE 551,"Transport Phenomena in Biological Systems","An integrated interdisciplinary systems-based examination of biological transport phenomena (momentum, heat and mass) and hemodynamics through mathematical modeling and biological processes as applied to physiological systems, with a focus on the cardiovascular, respiratory, and renal systems.",BIE 503,BIE 505,BIO 151,BIO 152,MTH 218
BIE 560,"Biological Processing of Wastewater","Measuring the characteristics of wastewater producted from domestic and industrial sources. Principles of designing and operating microbiological processes for the treatment of wastewater. Mechanism and kinetics of biological reactions emphasized.",CHM 124
BIE 561,"Biomedical Engineering I","Introduction to the fndamental concepts in biomedical engineering with specific focus on chemical engineering applications. Biomedical topics include overviews of areas such as biomaterials, tissue engineering, biosensors and biomedical engineering technology.",BIO 151,CME 324,BIE 501
BIE 533,"Biofuel","The course will provide an overview of the range of fuels derived from biological materials and processes, with a focus on anaerobic digestion, bioethanol and biodiesel and production of synthetic fuel from biological materials. The course will include an overview of the biochemistry of energy production in biological systems, discussions of the economics and environmental sustainability of biofuels, and a review of reactor and separation systems concepts relevant to biofuel production. Prerequisite(s) EGR 202, CHM 123 or consent of instructor.",EGR 202,CHM 123
BIE 511,"Biomaterials","The course introduces students with engineering materials used in dentistry, manufacture of surgical devices, prosthetics, and repair of tissues. Topics include bonding and atomic arrangement in materials, material selection, testing, and characterization, biocompatibility, tissue response to materials, and failutre analysis. A spectrum of materials including metals, polymers, ceramics, and composites used in biomedical applications will be considered."
BIE 529,"Computational Chemistry","Introduction to computational chemistry including a discussion of ab initio, semiempirical, and DFT methods and an overview of molecular mechanics and molecular simulation methods. Lectures are supplemented by simulation exercises using commercial programs such as Gaussian and Milecular Studio.",CHM 124
BIE 521,"Biomechanical Engineering","Application of engineering principles to clinical, occupational, and sports biomechanics topics. The course focuses on biomechanical analysis, particularly kinematics and kinetics of human movement, with emphasis on both research and product design.",EGM 202,EGR 201
BIE 505,"Principles of Engineering for Bioengineers","This course is designed for students with an undergraduate degree in science. The focus of the course is to provide a common broad base of basic knowledge and terminology in engineering required for coursework in the bioengineering emphasis tracts. It will cover basic mass and energy conservation and provide an introduction to thermodynamics, fluid mechanics, and heat and mass transfer.",MTH 219
BIE 507,"Bioengineering Experimentation Techniques","Lecture/laboratory based course in basic biology laboratory techniques, generating testable hypotheses, formulating experimental design, report writing, and scientific presentation. Students will be introduced to basic techniques in DNA cloning, protein purification, RNA isolation, and bioengineering applications. Corequisite(s): (BIE 503 or equivalent) or permission of instructor.",BIE 503
BIE 501,"Introduction to Bioengineering","This class provides an introduction to bioengineering - a branch of engineering focusing on biological systems, biomaterials, engineering applications in living systems, and many other areas. By the end of this course, students will be able to understand bioengineering applications and processes, and properly apply engineering fundamentals, including transport phenomena and reaction kinetics, to these systems. Prequisites(s):BIO 501, CME 324 or MEE 308 or permission of instructor.",BIO 501,CME 324,MEE 308
BIE 503,"Principles of Biology for Bioengineers","This course is designed for students with undergraduate majors in engineering or non-biological sciences. The focus of the course is to provide a common broad base of basic knowledge and terminology in the biological sciences required for coursework in the bioengineering emphasis tracts.",BIO 151,BIO 152
