BIO 511,"Ecosystem Dynamics","An advanced course examining ecosystem structure and function. Emphasis on community level interactions, applied ecology and the ways in which ecosystem biodiversity can be influenced by the biotic and abiotic forces of the environment, including the global impact of the human species."
BIO 509,"Ecological Restoration","Principles and practices of ecological restoration. The course presents the rationale and knowledge needed to understand, appreciate, plan and perform ecological restoration."
BIO 503,"College Teaching Seminar","To assist graduate teaching assistants in acquiring information, understanding, and skills seen as important components of effective teaching."
BIO 522,"Immunology","Study of innate and acquired immunity, cells and organs of the immune system, antigens and immunoglobulins. Specific emphasis on the organization and expression of immunoglobulin genes; genetic restriction; cytokines and immune regulation including hypersensitivity, immune tolerance, transplantation and autoimmunity. Biochemistry recommended."
BIO 501,"Seminar","Presentation of biological research data by faculty members and visiting scientists. Required of all graduate students each semester."
BIO 555,"Laboratory Techniques (Topic)","Advanced treatment of new techniques and instrumentation used in specialized areas of biology. Changes with advances in a specialty are reflected in the course title."
BIO 554,"Scientific Practice","Students are prepared for practicing aspects of a scientific profession. Scientific ethics, grant and manuscript writing, internal regulatory boards, and intellectual properties are covered. This course also covers topics in the responsible conduct of research drawing from case studies from the Association of American Medical Colleges and the NIH. Students will review case studies in preparation for class discussion. Graduate Student Standing."
BIO 551,"Laboratory Skills in the Biological Sciences","Laboratory Skills in the Biological Sciences (Bio 552-P3), taught in the Department of Biology, is tailored to introduce our graduate students to this fast changing field of research by teaching shared methodologies and techniques involved in biology."
BIO 550,"Biometrics","Design and analysis of experiments in quantitative biology. Parametric and nonparametric analyses of both laboratory and field-generated data sets."
BIO 553,"Research Methods in Ecology","Advanced research techniques and instrumentation in Ecology and Field Biology."
BIO 552,"Research Methods in Biomedical Science","Theory and applications of protein and nucleic acid techniques designed to acquaint students with advanced laboratory techniques used in biological research."
BIO 566,"Biology of Infectious Disease","The nature of infectious diseases, host-parasite relationships in resistance and infection, defense mechanism (antigen-antibody response); survey of the bacteria causing disease in humans; in-depth discussion of current infectious disease research."
BIO 535,"Problems in Field Biology","Course designed to acquaint students with field-oriented problems in biology."
BIO 545,"Evolution & Development","Molecular and population genetic examination of the evolution of animal form. Topics include comparative developmental biology, population genetics, and molecular evolution."
BIO 599,"Thesis","Research for the master's degree."
BIO 594,"Molecular Biology - Theory & Practice","Introduction to the theory and practice of molecular biology techniques. Topics and laboratory exercises include the enzymatic manipulation of DNA and RNA, Southern and Northern blotting, library screening, DNA sequencing, DNA amplification, and gene promoter structure and function."
BIO 596,"Current Biology Problems","Consideration of recent developments in biological thought and procedure."
BIO 425L,"Parasitology Laboratory","Recognition of common human parasites. Study of both living and preserved forms. One three-hour laboratory per week. Corequisite(s): BIO 425.",BIO 425
HSS 307,"Human Physiology","Survey of the functions of body systems with respect to general cell physiology and specialization into tissues, structural contributions to tissue/organ physiology, pertinent concepts of biochemical physiology, tissue metabolism and energy/food requirements during stress and exercise, recent research into control and regulation of functions of major systems, physiologic limitations outside environmental ranges, and selected examples of pathophysiology.",CHM 123,CHM 124,HSS 305,BIO 151,BIO 152
HSS 305,"Human Anatomy","Study of the human body with emphasis on the interdependent relationships of structure and function.",CHM 123,CHM 123L,CHM 124,CHM 124L,BIO 151,BIO 151L,BIO 152,BIO 152L
HSS 321,"Essentials of Personal Training","To provide students with specific, real-world information regarding the knowledge, skills, and expectations associated with a competent personal trainer or fitness professional. Additionally, this course is designed to prepare students for the nationally accredited Certified Personal Trainer (CPT) certification exam.",HSS 305,BIO 475
BIO 403,"Physiology I","Physical-chemical examination of the physiological events occurring in a living system with emphasis on physiology of the cell, excretion, nerves, muscles, bone, blood, heart, circulation, and respiration.",BIO 152,CHM 314
BIO 402,"Vertebrate Zoology","The morphology, physiology, ecology, and distribution of representative vertebrate groups.",BIO 310,BIO 312
CME 590,"Introduction to Bioengineering","This class provides an introduction to bioengineering - a branch of engineering forcusing on biological systems, biomaterials, engineering applications in living systems, and many other areas. By the end of this course, students will be able to understand bioengineering applications and processes, and propery apply enginerring fundamentals, including transport phenomena and reaction kinetics, to these systems.",BIO 151,CME 324,MEE 308
CME 591,"Biomedical Engineering I","Introduction to the fundamental concepts in biomedical engineering with a special focus on chemical engineering applications. Biomedical topics include overviews of areas such as biomaterials, tissue engineering, biosensors and biomedical engineering technology. Second term, each year.",BIO 151,CME 324,BIE 501
BIO 435,"Microbial Ecology","Study of the diversity and activity of microorganisms and the interrelationships between microorganisms and their environments with emphasis on aquatic ecosystems.",BIO 411,CHM 314
BIO 427,"Immunology","Discussions of antigens, antibodies, antigenicity, immunogenicity, and antigen-antibody reactions including hypersensitivity, immune tolerance, and transplants.",BIO 403,BIO 411,BIO 440,BIO 442,CHM 420
BIO 445,"Evolution & Development","Molecular and population genetic examination of the evolution of animal form. Topics include comparative developmental biology, population genetics, and molecular evolution.",BIO 312
BIO 444,"Plant Diversity","Broad survey of the major divisions of the plant kingdom; consideration of algae, fungi, bryophytes, vascular plant groups; includes generalized life histories, ecological and physiological characteristics, and evolutionary relationships.",BIO 310
BIO 441,"Environmental Plant Biology","Study of the physiological basis for environmental effects on plant metabolism, structure, growth and development, including plant responses to elevated carbon dioxide, acid deposition, and water stress.",BIO 310,BIO 312
BIO 440,"Cell Biology","Study of the function, structure, composition, heredity, and growth of cells. Analysis of cell concepts in biochemical terms.",BIO 152,CHM 314
BIO 442,"Developmental Biology","Study of animal development, including morphological patterns of development, mechanisms of cellular differentiation, cell-cell interactions during development, and mechanisms of differential gene expression. Emphasis on understanding development at the cellular and molecular levels.",BIO 152,CHM 314
BIO 439,"Analysis & Interpretation of Biological Data","Introducing the nature of some of the important types of data that are generated in biological research, the databases that warehouse such data, the principles involved in the analysis of such data, the use of appropriate software to analyze such data, and the biological interpretation of the results of analysis.",BIO 152
BIO 412,"Genetics Human Diseases","Study of the molecular genetics of inherited human diseases using a systems approach. Survey of inherited diseases linked to major organs and organ systems.",BIO 312,CHM 313
BIO 411,"General Microbiology","Introductory course stressing the physiology, cultivation, and classification of microbial organisms; their role in medicine, agriculture, and industry.",BIO 152,CHM 313
BIO 409,"Ecological Restoration","Principles and practices of ecological restoration. The course presents the rationale and knowledge needed to understand, appreciate, plan and perform ecological restoration.",BIO 310
BIO 404,"Physiology II","Integrated systems based examination of physiological processes in humans with a special emphasis on molecular mechanisms of pathophysiological conditions in humans and experimental animal systems.",BIO 403
BIO 407,"Plant Diversity & Ecology","Lecture course addressing plant diversity and ecology. Course includes an overview of plant systematics and aspects of plant anatomy, population ecology, community ecology, ecosystem ecology, and global ecology.",BIO 310
BIO 422,"Biological Problems","Library research problems. Topics arranged with faculty advisors.",BIO 310,BIO 312
BIO 425,"Parasitology","Introduction to the morphology, life history, and clinical significance of parasites and other symbionts.",BIO 310,BIO 312
BIO 421,"Biological Problems","Laboratory research problems. Topics arranged with faculty advisors.",BIO 310,BIO 312
BIO 420,"Biology Capstone Seminar","Seminar course designed to further develop students’ ability to communicate and synthesize within their discipline and prepare them for their chosen career paths in the Biological and Environmental professions. All class activities, including presentations, relate to key issues facing society today in addition to continued career development skills. Biology core and capstone course.",BIO 299,BIO 310,BIO 312
BIO 415,"Neurobiology","Structure and function of the brain and nervous system. Emphasis on understanding cellular and molecular events within the nervous system using model organisms.",BIO 152,CHM 124
BIO 470,"Cancer Biology","Study of growth patterns and causes of cancer at the cellular and molecular levels. Discussion of the hereditary and environmental factors that contribute to the development of the disease in cancer patients. Description of the research being conducted to understand and cure the disease.",BIO 403,BIO 440
BIO 478,"Honors Thesis Project","Second of two courses leading to the selection, design, investigation, and completion of an independent, original Honors Thesis project under the guidance of a faculty research advisor. Restricted to students in the University Honors Program with permission of the program director and department chairperson. Students pursuing an interdisciplinary thesis topic may register for three semester hours each in two separate disciplines in consultation with the department chairpersons."
BIO 477,"Honors Thesis Project","First of two courses leading to the selection, design, investigation, and completion of an independent, original Honors Thesis project under the guidance of a faculty research advisor. Restricted to students in the University Honors Program with permission of the program director and department chairperson. Students pursuing an interdisciplinary thesis topic may register for three semester hours each in two separate disciplines in consultation with the department chairpersons."
BIO 101L,"Life, Environment, and Society Laboratory","A hands-on approach to the study of life, understanding how life interacts with the environment, and the role of biological inquiry in society. Lab activities will stress an experiential, inquiry-based approach to topics relevant in today's society in an effort to increase student's abilities to critically evaluate modern science media. Laboratory topics are designed to run parallel to lecture topics. Recommended that the laboratory be taken concurrently with BIO 101 lecture. One two-hour laboratory per week. For non-science majors. Corequisite(s): BIO 101.",BIO 101,BIO 101
BIO 475,"Human Anatomy","Study of the fundamental principles of human gross anatomy with emphasis on all organ systems.",BIO 152,CHM 314
BIO 480,"Principles of Microscopy","Focus on basic principles and theory of light and electron microscopy, and how these techniques address fundamental questions in science.",BIO 152
BIO 489,"Mycology","Introductory course stressing the interrelationship between fungi and the rest of the biological world. Emphasis on the basic biology and ecology of fungi, decomposition, species interactions, plant pathology and medical mycology.",BIO 152
BIO 450,"Comparative Animal Physiology","Organized on a function-system basis, course dealing with environment-organism interaction and with integrative systems of the principle phyla of animals.",BIO 310,BIO 312,CHM 124
BIO 452,"Biology of Rivers & Lakes","The biological interrelationships of organisms in rivers, streams, lakes and ponds including biodiversity, ecological/evolutionary adaptations and structure of aquatic ecosystems.",BIO 310
BIO 461,"Invertebrate Zoology","Survey of the structure, activities, life histories, and relationships of the invertebrate animals, with some emphasis on their origin and development.",BIO 310,BIO 312
BIO 460,"Introduction to Bioinformatics","This course introduces the concepts involved in bioinformatics, using the appropriate material from the disciplines of biology, chemistry and computer science, among others.",BIO 152
BIO 466,"Biology of Infectious Disease","The nature of infectious diseases, host-parasite relationships in resistance and infection, defense mechanism (antigen-antibody response); survey of the bacteria causing disease in humans.",BIO 411
BIO 462,"Molecular Biology","Analysis of the nature of the gene and gene action. Particular attention to genetic regulation and to recent advances in molecular genetics.",BIO 312,CHM 314
BIO 465,"Disease Ecology","Examination of ecological factors affecting the emergence and dynamics of infectious diseases of humans and wildlife. History and overview of how diseases are often a product of populations, communities, ecosystems, and global systems. Includes an introduction to epidemiology and current molecular and geographic information system techniques used to study these integrated systems.",BIO 310,BIO 411
BIO 459,"Environmental Ecology","The application of current ecological knowledge and principles toward the study of human impact on the environment. Emphasis on ecosystem dynamics, applied ecology, disturbance ecology, and approaches to solving global environmental problems.",BIO 310
CME 523,"Transport Phenomena in Biological Systems","An integrated interdisciplinary systems-based examination of biological transport phenomena (momentum, heat and mass) and hemodynamics through mathematical modeling and biological processes as applied to physiological systems, with a focus on the cardiovascular, respiratory, and renal systems.",BIE 503,BIE 505,BIO 151,BIO 152,MTH 218
BIO 499,"Environmental Biology Internship","Majors will have the opportunity to obtain valuable training and experience under the mentorship of established scientists and professionals. Emphasis on approaches to solving environmental problems including such research areas as bioremediation, risk assessment, and ecological restoration. May be repeated up to six semester hours. No science credit for biology majors."
BIO 496,"Special Topics in Biology","Lecture course addressing advanced topics in biology. Topics are variable depending on faculty teaching the course and the course aims. Students should consult the class schedule. May be repeated.",BIO 151,BIO 152
BIO 411L,"General Microbiology Laboratory","Lab exercises focusing on the basic techniques involved in the isolation and identification of bacteria, including assessment of biochemical activities, growth characteristics of bacteria, and the impact of the environment on microbial growth. One three-hour laboratory per week. Corequisite(s): BIO 411.",BIO 411
HSS 307L,"Human Physiology Laboratory","Virtual human physiological laboratory course meant to enhance the materials covered in HSS 307 - Human Physiology. Laboratory simulations in human physilogy to cover concepts such as, but not limited to, cell transport mechanisms and permeability, skeletal muscle physiology, endocrine system physiology, cardiovascular dynamics, cardiovascular physiology, respiratory system mechanics, renal system physiology, and blood analysis.",HSS 307,BIO 151,BIO 152,CHM 123,CHM 124,HSS 305,HSS 307
CME 489,"Principles of Biology for Bioengineers","This course is designed for students with undergraduate majors in engineering or non-biological sciences. The focus of the course is to provide a common broad base of basic knowledge and terminology in the biological sciences required for coursework in the bioengineering emphasis tracts.",BIO 151,BIO 152
CME 490,"Introduction to Bioengineering","This class provides an introduction to bioengineering - a branch of engineering focusing on biological systems, biomaterials, engineering applications in living systems, and many other areas. By the end of this course, students will be able to understand bioengineering applications and processes, and properly apply engineering fundamentals, including transport phenomena and reaction kinetics, to these systems.",BIO 151,BIO 152,CME 324,MEE 308
CME 491,"Biomedical Engineering I","Introduction to the fundamental concepts in biomedical engineering with a special focus on chemical engineering applications. Biomedical topics include overviews of areas such as biomaterials, tissue engineering, biosensors and biomedical engineering technology.",BIO 151,BIO 152,CME 324
BIO 440L,"Cell Biology Laboratory","Experimental approaches to explore modern concepts in cell structure, function, and biology. One three-hour laboratory per week. Corequisite(s): BIO 440.",BIO 440
HSS 401,"Nutritional Biochemistry I","Extension of the student's knowledge of the science of nutrition, stressing the metabolism of food constitutents and recent advances in the field of nutrition.",BIO 403,HSS 307,CHM 314,HSS 295
BIO 444L,"Plant Diversity Laboratory","Laboratory studies of the plant groups, including life cycles and evolutionary, physiological, and ecological adaptations. One three-hour laboratory per week. Corequisite(s): BIO 444.",BIO 444
BIO 312L,"Genetics Laboratory","Exploration of heredity using molecular genetic methods. One three-hour laboratory per week. Corequisite(s): BIO 312.",BIO 312
BIO 442L,"Developmental Biology Laboratory","Exploration of the development of key model organisms from the morphological and molecular perspectives with an emphasis on basic developmental laboratory techniques. One three-hour laboratory per week. Corequisite(s): BIO 442.",BIO 442
BIO 310L,"Ecology Laboratory","Measurement of population, community, and environmental variables in terrestrial and aquatic systems. The lab is field-based using local ecological resources. One three-hour laboratory per week and weekend field trips. Corequisite(s): BIO 310.",BIO 310
BIO 314L,"Plant Biology Laboratory","Emphasis on generalized structure and function of plants. One three-hour laboratory per week. Corequisite(s): BIO 314.",BIO 314
BIO 309L,"Comparative Anatomy Laboratory","Dissection and study of the anatomical structure of representative vertebrate animals. One three-hour laboratory per week. Corequisite(s): BIO 309.",BIO 309
BIO 601,"Special Topics","Development, presentation, and discussion of topics in specialized areas of biology. Required of graduate students each semester."
BIO 699,"Dissertation","Research for the doctoral degree."
BIO 435L,"Microbial Ecology Laboratory","Examination of the methods of isolation and enumeration of microorganisms and techniques for determining their activities in the field and laboratory. One three-hour laboratory per week. Corequisite(s): BIO 435.",BIO 435
BIO 461L,"Invertebrate Zoology Laboratory","Examination of the structure and function of the major invertebrate phyla. Survey of representative animals with an emphasis on observational skills for analysis of the structural adaptations of live animals. One three-hour laboratory per week. Corequisite(s): BIO 461.",BIO 461
BIO 330L,"Animal Behavior Laboratory","Analysis of animal behavior using various animal models. One three-hour laboratory per week and occasional Saturday field trips. Corequisite(s): BIO 330.",BIO 330
BIO 101,"Life, Environment, and Society","An introductory course covering the study of life in all its forms, understanding how life interacts with the environment and the role of biological inquiry in society. Emphasis will be placed on discussing topical issues relevant to evaluating the critical role of the life sciences in society today. Supporting laboratory strongly recommended, but optional. No prerequisite. For non-science majors only."
BIO 151,"Concepts of Biology I: Cellular & Molecular Biology","Introduction to the biological concepts surrounding cell and molecular biology. Topics include scientific practice, molecular basis of life, cellular composition and energy processes, genetics, and biotechnology. Intended for science majors. Core biology course."
BIO 152,"Concepts of Biology II: Evolution & Ecology","Introduction to the biological concepts surrounding evolution and ecology. Topics include scientific practice, evolutionary basis of life, phylogeny and systematics, biodiversity, ecology and biosphere sustainability. Intended for science majors. Core biology course."
BIO 151L,"Concepts of Biology Laboratory I: Cellular & Molecular Biology","Laboratory-based introduction to the biological concepts surrounding cell and molecular biology. Utilizing a hands-on approach to the study of life, students will take part in experiential, inquiry-based activities as they observe the properties of cellular, micro-scale biology while concurrently defining proper laboratory procedures, operating modern scientific instrumentation, and practicing effective documentation of experiments. Topics include scientific practice, biological instrumentation, cellular composition and processes, genetics, and biotechnology. One three-hour lab per week. Intended for science majors. Core biology course. Corequisite(s): BIO 151.",BIO 151
BIO 152L,"Concepts of Biology Laboratory II: Evolution & Ecology","Laboratory-based introduction to the biological concepts surrounding evolution, diversity and ecology. Utilizing a hands-on approach, students will take part in experiential, inquiry-based activities as they explore the concepts of evolution and macro-scale biology while concurrently developing proper laboratory procedures, operating modern scientific instrumentation, and practicing effective scientific presentation of research through the two most widely accepted formats: the scientific journal article and the research poster presentation. Topics include evolution and phylogeny, the diversity of life, ecology, and human impact on ecosystems. One three-hour laboratory per week. Intended for science majors. Core biology course. Corequisite(s): BIO 152.",BIO 152
BIO 2XXL,"Non-equivalent transfer",""
BIO 452L,"Biology of Rivers & Lakes Laboratory","Laboratory and field exercises emphasizing the biological, chemical and physical attributes of freshwater ecological systems. One three-hour laboratory or field trip per week. Corequisite(s): BIO 452.",BIO 452
BIO 320L,"Marine Biology Laboratory","Examination of marine organisms and processes. Laboratory work conducted on UD campus and at off-campus field sites in the southern United States or Hawaii.",BIO 320
GEO 479L,"Envrionmental Instrumentation Laboratory","The understanding and use of field and laboratory based equipment to study current environmental issues. Emphasis on team-centered approaches to investigating environmental problems.",BIO 151,BIO 152,GEO 115,GEO 116
BIO 450L,"Comparative Animal Physiology Laboratory","Examination of physiological responses to the physical environment. Variations of the physical environment are examined in the field. Study of animals under controlled laboratory conditions with experimental design, data collection and analysis to assess physiological adaptations. One three-hour laboratory or field trip per week. Corequisite(s): BIO 450.",BIO 450
BIO 459L,"Environmental Ecology Laboratory","Analytical approach to studying applied ecology and human impact on the environment. Emphasis on laboratory and field approaches to solving environmental problems through the use of ecological principles. One three-hour laboratory per week. Corequisite(s): BIO 459.",BIO 459
BIO 402L,"Vertebrate Zoology Laboratory","Laboratory focused on the diversity, systematics and ecology of vertebrates. One three-hour laboratory per week. Corequisite(s): BIO 402.",BIO 402
BIO 403L,"Physiology Laboratory I","Systematic approach to the acquisition and interpretation of information about the physiology of living systems. One three-hour laboratory per week. Corequisite(s): BIO 403.",BIO 403
