BIE 551,"Transport Phenomena in Biological Systems","An integrated interdisciplinary systems-based examination of biological transport phenomena (momentum, heat and mass) and hemodynamics through mathematical modeling and biological processes as applied to physiological systems, with a focus on the cardiovascular, respiratory, and renal systems.",BIE 503,BIE 505,BIO 151,BIO 152,MTH 218
BIE 561,"Biomedical Engineering I","Introduction to the fndamental concepts in biomedical engineering with specific focus on chemical engineering applications. Biomedical topics include overviews of areas such as biomaterials, tissue engineering, biosensors and biomedical engineering technology.",BIO 151,CME 324,BIE 501
BIO 409L,"Ecological Restoration Laboratory","Practical applications of the principles of ecological restoration to a variety of ecosystems. One three-hour laboratory per week. Corequisite(s): BIO 409.",BIO 409
BIO 407L,"Plant Diversity & Ecology Laboratory","Field laboratory course addressing plant diversity and ecology. Includes a series of field labs focused on plant identification, followed by labs focused on quantitatively assessing plants, plant communities, and ecosystems. Labs will take place in a variety of natural areas. Corequisite(s): BIO 407.",BIO 407
BIE 501,"Introduction to Bioengineering","This class provides an introduction to bioengineering - a branch of engineering focusing on biological systems, biomaterials, engineering applications in living systems, and many other areas. By the end of this course, students will be able to understand bioengineering applications and processes, and properly apply engineering fundamentals, including transport phenomena and reaction kinetics, to these systems. Prequisites(s):BIO 501, CME 324 or MEE 308 or permission of instructor.",BIO 501,CME 324,MEE 308
BIE 503,"Principles of Biology for Bioengineers","This course is designed for students with undergraduate majors in engineering or non-biological sciences. The focus of the course is to provide a common broad base of basic knowledge and terminology in the biological sciences required for coursework in the bioengineering emphasis tracts.",BIO 151,BIO 152
BIO 360L,"Island Environmental Biology Laboratory","Lab field course on Pacific Islands. Ecology of elevational and rainforest-desert gradients, volcanic mountain streams, watersheds, and coral systems with experimental design, data collection and analysis.",BIO 360
BIO 312,"General Genetics","Study of the principles of variation and heredity covering both Mendelian and molecular genetics. Core biology course.",BIO 152
BIO 314,"Plant Biology","Consideration of structure, function, reproduction, and inheritance as applicable in the plant patterns of life. Emphasis on the vascular plants.",BIO 152
BIO 311,"Introductory Entomology","Classification, physiology, ecology, and impact of insects on society.",BIO 152
BIO 310,"Ecology","Interrelationship of plants, animals, and micro-organisms with the physical-chemical environment: nutrient cycles, energy flow, ecosystems, and factors affecting distribution and abundance of organisms. Core biology course.",BIO 152
BIO 309,"Comparative Anatomy of the Vertebrates","Study of changes that have occurred in the vertebrate body with the passage of time, and analysis of their significance.",BIO 152
BIO 320,"Marine Biology","Introduction to the diversity of marine life including the physical-chemical environment.",BIO 320L
BIO 350L,"Applied Microbiology Laboratory","An introductory laboratory to acquaint students with basic microbiology laboratory techniques as applied to environmental pollution and industrial fermentations. One three-hour laboratory per week. Corequisite(s): BIO 350.",BIO 350
BIO 301,"Evolution","Theory and evidence of organic evolution, with emphasis on microevolutionary change and population genetics.",BIO 152
BIO 350,"Applied Microbiology","Fundamentals of applied and environmental microbiology for environmental scientists and engineers. Introduction to microorganisms and their role in bioenvironmental engineering and industrial processes. No science credit for biology majors.",BIO 152,CHM 314
BIO 359,"Sustainability & the Biosphere","Study of the principles of sustainability. All areas of sustainability will be covered with emphasis on ecological facets of sustainability. Discussion of loss of habitat and biodiversity in the context of sustaining natural resources for future generations.",BIO 152,SCI 230
BIO 360,"Island Environmental Biology","Field lecture course on environments of Pacific Islands. Study of volcanic geology, island morphology/weather-patterns, native culture, economic development, freshwater-marine continuum and water resource utilization on unique biological habitats.",BIO 360L
BIO 330,"Animal Behavior","An evolutionary approach to the study of animal behavior, emphasizing both proximate mechanisms and functional explanations of the survival value of behavior.",BIO 152
BIO 340,"Culture, Biodiversity & Resources Management","Field lecture course addressing cultural impacts on biodiversity and conciliatory demands for resource management to preserve the integrity of unique global environments. An experiential study of culture, regional geological morphology and weather-patterns, economic development, the freshwater-marine continuum, resource utilization, environmental law and management on conservation of unique biological habitats and organisms.",BIO 340L
BIO 395,"Global Environmental Biology","Presentation of the biological and ecological principles needed for the critical discussion and evaluation of current global issues related to human impact on the environment. Ecological data on the current extinction crisis and sustainable solutions will be addressed. No credit toward a biology major or minor.",BIO 101,BIO 151,SCI 230
BIO 370,"Conservation Biology","An ecosystem approach to the study of and threat to local, regional, and global biodiversity. Application of ecological principles of conservation of species and habitats.",BIO 152
BIO 480L,"Principles of Microscopy Laboratory","Application and practice of light and electron microscopy. One three-hour laboratory per week. Corequisite(s): BIO 480.",BIO 480
BIO 340L,"Culture, Biodiversity & Resources Management Laboratory","Lab field course on culture, biodiversity and balanced resource management to preserve integrity of unique global environments and compromises with economic development. Assessment of biodiversity in diverse biomes (e.g. elevational and rainforest-desert gradients, watersheds, coral reef systems) will be assessed with experimental design, data collection and analysis. May fulfill only one laboratory requirement for the Biology major.",BIO 340
BIO 475L,"Human Anatomy Laboratory","Study of human gross anatomy emphasizing all organs systems using computer-assisted dissection, anatomical human models and occasional dissection of nonhuman cadaver organs. One three-hour laboratory per week. Corequisite(s): BIO 475.",BIO 475
BIO 479L,"Environmental Instrumentation Laboratory","The understanding and use of field- and laboratory-based equipment to study current environmental issues. Emphasis on team-centered approaches to investigating environmental problems. Same as GEO 479L. One five-hour laboratory or field trip per week.",GEO 479L,BIO 310,GEO 116
BIO 299,"Biology Seminar","Introduction to biological journals and abstracting materials. Practice in reviewing, abstracting, and presenting biological information, and career development. Core biology course. Biology and environmental biology majors only.",BIO 152
