GER 202,"Intermediate German II","Systematic grammar review. Increased use of the language in written exercises and classroom discussions based on readings. Exposure to the development of German civilization and culture.",GER 201
GER 201,"Intermediate German I","Systematic grammar review. Increased use of the language in written exercises and classroom discussions based on readings. Exposure to the development of German civilization and culture. Successful completion of this course includes the demonstration of the proficiency level required by the College of Arts and Sciences' Liberal Studies Curriculum.",GER 141
GER 101,"Basic Proficiency in German I","Development of basic communication and intercultural skills in reading, listening, writing, and speaking through extensive practice in language use. Admission is restricted to those who have not studied German or have placed into this course by examination."
GER 131,"Intensive Fundamental German","Field-based course examining the geologic history of the Miami Valley and Dayton area; processes leading to the modern landscape; the impact of human activity will be assessed.",GEO 109
GER 141,"Basic Proficiency in German II","Further development of fundamental communication and intercultural skills in reading, listening, writing, and speaking through extensive practice in language use.",GER 101,GER 131
GER 450,"German Literature","Lectures and discussions in German in such specialized areas as Medieval lyric, Romanticism, twentieth-century novel, modern drama, and individual authors. Repeatable when subtitle and content change.",GER 311,GER 312
GER 478,"Honors Thesis Project","Second of two courses leading to the selection, design, investigation, and completion of an independent, original Honors Thesis project under the guidance of a faculty research advisor. Restricted to students in the University Honors Program with permission of the program director and department chairperson. Students pursuing an interdisciplinary thesis topic may register for three semester hours each in two separate disciplines in consultation with the department chairpersons."
GER 477,"Honors Thesis Project","First of two courses leading to the selection, design, investigation, and completion of an independent, original Honors Thesis project under the guidance of a faculty research advisor. Restricted to students in the University Honors Program with permission of the program director and department chairperson. Students pursuing an interdisciplinary thesis topic may register for three semester hours each in two separate disciplines in consultation with the department chairpersons."
GER 469,"German Linguistics","Synchronic analysis of modern German language, including a contrast of the German sound system, morphology, and syntax with English structures; the historical derivation of German, the modern German dialects, and approaches to teaching German to English-speakers. Conducted in German.",GER 311,LNG 468
GER 491,"Independent Study","Independent research project under the guidance of an instructor. Admission to project and number of semester hours require approval of chairperson.",GER 202
GER 477H,"Honors Thesis","First of two courses leading to the selection, design, investigation, and completion of an independent, original Honors Thesis project under the guidance of a faculty research advisor. Restricted to students in the University Honors Program with permission of the program director and department chairperson. Students pursuing an interdisciplinary thesis topic may register for three semester hours each in two separate disciplines in consultation with the department chairpersons."
GER 478H,"Honors Thesis","Second of two courses leading to the selection, design, investigation, and completion of an independent, original Honors Thesis project under the guidance of a faculty research advisor. Restricted to students in the University Honors Program with permission of the program director and department chairperson. Students pursuing an interdisciplinary thesis topic may register for three semester hours each in two separate disciplines in consultation with the department chairpersons."
GER 312,"German Conversation II","Practice to increase listening comprehension and fluency in speaking about topics from the personal and everyday to issues of current interest with focus on describing and narrating in paragraph-length structures. In-depth exploration of cultural commonalities and differences between the German-speaking countries and the United States. Focus on development of vocabulary and practice of expressions essential for oral communication. May be taken in either sequence.",GER 202
GER 311,"German Conversation I","Practice to increase listening comprehension and fluency in speaking about topics from the personal and everyday to issues of current interest with focus on describing and narrating in paragraph-length structures. In-depth exploration of cultural commonalities and differences between the German-speaking countries and the United States. Focus on development of vocabulary and practice of expressions essential for oral communication. May be taken in either sequence.",GER 202
GER 325,"Commercial German","Introduction to the business language, customs, and economic profile of the German-speaking countries. Vocabulary of the office and world of trade. Business correspondence. Germany's economic and cultural position and goals within the context of the European Union and the world. Course provides an introduction to working in an international business setting.",GER 311,GER 312
GER 322,"German Composition II","Practice in personal and topical writing in German that seeks to develop the ability to write well-structured paragraphs. Systematic vocabulary building and grammatical refinement and review. Readings on key issues of the day and/or topics providing crucial insight into German and European thinking and concerns. May be taken in either sequence.",GER 311,GER 312
GER 321,"German Composition I","Practice in personal and topical writing in German that seeks to develop the ability to write well-structured paragraphs. Systematic vocabulary building and grammatical refinement and review. Readings on key issues of the day and/or topics providing crucial insight into German and European thinking and concerns. May be taken in either sequence.",GER 311,GER 312
GER 351,"German Film","Introduction to the aesthetic and thematic richness of German film. Students will study the cinema of the Weimar Republic within its historical context and its appropriation by Hollywood. This course will also introduce cross-cultural films having to do with idenity, women, immigrant workers, asylum seekers, postcolonialization, nationalism, social theory, ideology, and political activism.",GER 311,GER 312
GER 350,"German Literature & Civilization","Course to acquaint students with major German writers and literary movements. Conducted in English. Repeatable when subtitle and content change."
GER 342,"Germany and the New Europe","Examination of developments in the life and culture, and the political, economic, and social realities in Germany from the end of WWI to the reunited country of today which is the largest member of EU. Course also explores the ideas and ideals on which the EU is founded, its present influence in the world, and how this new Europe differs from the United States of America. Conducted in German.",GER 311
GER 341,"German Culture & Civilization","Introduction to German culture and civilization with emphasis on the arts, intellectual developments, and life in various periods of German history. Conducted in German.",GER 311,GER 312
GER 370,"Study Abroad","Intensive study in a foreign country whose everyday language is German, treating the culture and civilization of the country. Conducted in German. Available only during the summer session. Repeatable when subtitle and content change.",GER 202
GER 362,"Survey of German Literature II","German literary works from 1750 to the present reflecting the philosophy, aesthetics, and concerns of the time. Skills development for reading literary and cultural texts and writing on analytic and interpretative topics. May be taken in either sequence.",GER 311,GER 312,GER 321,GER 322
GER 361,"Survey of German Literature I","German literary works from 1750 to the present reflecting the philosophy, aesthetics, and concerns of the time. Skills development for reading literary and cultural texts and writing on analytic and interpretative topics. May be taken in either sequence.",GER 311,GER 312,GER 321,GER 322
